type,first-name-and-last-name,source-where-i-found,gender,education,birthplace,most-famous-pieces,example_art,travels,family,museums,auctions,genres,sources-of-data
artists,Михайло Ряснянський ,https://t.me/moja_ukraina/1763,M,Ростовське художнє училище; Київський державний художній інститут;,м. Таганрог Ростовської області,«Бабусин город»; «Крізь віки»; «Туман»; «Старий млин»; «Синь»; «Похмурий ранок»; «Тиша»; «Острів Березань»;,https://l-art.kiev.ua/image/catalog/2595.jpg,,народився в сім'ї столяра;,,,Реалізм;,https://www.laginlib.org.ua/moya-mykolayivshhyna/suzir-ya-myttsiv-mykolayivshhyny/ryasnyanskyj-m-o/
artists,Йосип Бокшай,https://t.me/moja_ukraina/1753,M,Академія образотворчих мистецтв в Будапешті;,"с. Кобилецька Поляна, нині смт Рахів","«Автопортрет»; «Базар в Ужгороді»; «Зима»; «Проповідь»;  «Святий Іван Златоуст на літургії»; 
«Вчителі східної вселенської церкви»; «Святі Руської землі»; ",https://ua.gs-art.com/upload/iblock/1ab/29.jpg,,народився у родині греко-католицького священика;,,,Реалізм;,http://artedu.uz.ua/2198-bokshay-yosip-yosipovich-1891-1975.html
artists,Фотій Красицький,https://t.me/moja_ukraina/1749,M,Київська рисувальна школа; Одеське художнє училище;,с. Зелена Діброва Черкаської області;,«Гість із Запоріжжя»; «Баба Олійничиха»; «Дід Грицько»; «У найми»; «За обідом»; «У хаті шевця» ; «Біля криниці»;,https://upload.wikimedia.org/wikipedia/commons/0/00/%D0%9A%D1%80%D0%B0%D1%81%D0%B8%D1%86%D1%8C%D0%BA%D0%B8%D0%B9_%D0%A4%D0%A1_%D0%93%D1%96%D1%81%D1%82%D1%8C_%D1%96%D0%B7_%D0%97%D0%B0%D0%BF%D0%BE%D1%80%D1%96%D0%B6%D0%B6%D1%8F_1916.JPG,,народився у селянській родині;,"Національний му­зей у Львові; Національний художній музей; Національному музеї українського народного декоративного мистецтва; 
Національному музеї історії України; Національному музеї Тараса Шевченка у Києві; Миргородському краєзнавчому музеї; 
Полтавському художньому музеї;  Ілюстрації до журналу «Шершень» та інші роботи митця знаходяться в Музеї Однієї Вулиці у Києві;",,Реалізм;,https://uk.wikipedia.org/wiki/%D0%9A%D1%80%D0%B0%D1%81%D0%B8%D1%86%D1%8C%D0%BA%D0%B8%D0%B9_%D0%A4%D0%BE%D1%82%D1%96%D0%B9_%D0%A1%D1%82%D0%B5%D0%BF%D0%B0%D0%BD%D0%BE%D0%B2%D0%B8%D1%87
artists,Михайло Сажин,https://t.me/moja_ukraina/1735,M,Петербурзька академія мистецтв;  Вихованець Товариства заохочення художників;,м.  Галич Костромської губернії;,"«Руїни Золотих Воріт у Києві»; «Краєвид з Подолу»; «Рибальські халупи на березі Дніпра»; «Видубецький монастир»;
 «Щекавиця — місце поховання кн. Олега»; «Андріївський собор у Києві»; «Біля переправи через Дніпро»;",https://upload.wikimedia.org/wikipedia/commons/thumb/0/0a/Sagun.jpg/349px-Sagun.jpg,,народився у купецькій родині;,Київський Музей українського мистецтва; Будинок-музей Тараса Шевченка;,,Реалізм;,https://uk.wikipedia.org/wiki/%D0%A1%D0%B0%D0%B6%D0%B8%D0%BD_%D0%9C%D0%B8%D1%85%D0%B0%D0%B9%D0%BB%D0%BE_%D0%9C%D0%B0%D0%BA%D0%B0%D1%80%D0%BE%D0%B2%D0%B8%D1%87